{
  "schema_version": 2,
  "rationale": "This lineup fills the available legal starting slots and maximizes the supported weekly projected scoring components while preserving locked starters. It retains the observed starting assignments. The modeled gain is 0.00 supported points. These forecasts omit some league scoring categories; this proposal requires fresh validation and has not been applied.",
  "rationale_source": "deterministic_report_summary",
  "league_id": "1400628784381612032",
  "roster_id": 10,
  "season": 2026,
  "week": 1,
  "created_at": "2026-09-11T19:27:05.332047+00:00",
  "origin": {
    "kind": "optimizer",
    "input_hash": "3885a7868383ae507f8b2478e21ed95a6a087763b8a02c024501b4a8d809a405",
    "engine_version": 1
  },
  "assignments": [
    {
      "slot_index": 0,
      "slot": "QB",
      "player_id": "8183"
    },
    {
      "slot_index": 1,
      "slot": "RB",
      "player_id": "3198"
    },
    {
      "slot_index": 2,
      "slot": "RB",
      "player_id": "6790"
    },
    {
      "slot_index": 3,
      "slot": "WR",
      "player_id": "9997"
    },
    {
      "slot_index": 4,
      "slot": "WR",
      "player_id": "9487"
    },
    {
      "slot_index": 5,
      "slot": "TE",
      "player_id": "12506"
    },
    {
      "slot_index": 6,
      "slot": "FLEX",
      "player_id": "4866"
    },
    {
      "slot_index": 7,
      "slot": "K",
      "player_id": "12711"
    },
    {
      "slot_index": 8,
      "slot": "DEF",
      "player_id": "PIT"
    }
  ],
  "lineup_id": "2b8e15c547064ce59f7800b07e343ad9",
  "recorded_at": "2026-09-11T19:27:05.823040+00:00",
  "previous_lineup_id": "5d7a3f65662444b2987d1bc17522c74f"
}