{
  "schema_version": 2,
  "rationale": "Initial Week 1 lineup selected at the user's request on September 9, 2026. Follow the deterministic weekly projection leader: start Brock Purdy over Patrick Mahomes (17.8432 versus 16.9302 supported projected points, a 0.913 gain). Sleeper's visible projections also favor Purdy, 18.75 versus 17.12. Retain Henry, Barkley, Flowers, Washington, Fannin, Swift, Loop and PIT. Scoring coverage is partial; this is not a guaranteed winning lineup.\n\nManual review of the validator's REVIEW findings: Flowers remains questionable, but the September 8 FantasyPros report says he practiced Tuesday after returning last Thursday. Swift remains questionable; his native Sleeper player card reports he practiced Monday after leaving practice with a reported cramp. Retain both for this initial lineup given their projection advantages and return-to-practice evidence, with availability unresolved until later in the week. This judgment does not convert the automated REVIEW into PASS or assert medical clearance. Quentin Johnston is the model's first individual replacement for either player; simultaneous absences require reoptimization. No automation has been scheduled.\n\nThe native Week 1 team page showed the expected current roster and future kickoff times, and allowed the Purdy/Mahomes swap. Browser read-back showed Purdy in QB and Mahomes in BN. Run central Sleeper verification for the full assignment record.",
  "rationale_source": "supplied_free_text",
  "league_id": "1400628784381612032",
  "roster_id": 10,
  "season": 2026,
  "week": 1,
  "created_at": "2026-09-09T05:02:47.163779+00:00",
  "origin": {
    "kind": "optimizer",
    "input_hash": "5f9d177d3c7c0a6f903ca82fb53112f0e0be854ac2740d361d043d627de2dcee",
    "engine_version": 1
  },
  "assignments": [
    {
      "slot_index": 0,
      "slot": "QB",
      "player_id": "8183"
    },
    {
      "slot_index": 1,
      "slot": "RB",
      "player_id": "3198"
    },
    {
      "slot_index": 2,
      "slot": "RB",
      "player_id": "4866"
    },
    {
      "slot_index": 3,
      "slot": "WR",
      "player_id": "9997"
    },
    {
      "slot_index": 4,
      "slot": "WR",
      "player_id": "9487"
    },
    {
      "slot_index": 5,
      "slot": "TE",
      "player_id": "12506"
    },
    {
      "slot_index": 6,
      "slot": "FLEX",
      "player_id": "6790"
    },
    {
      "slot_index": 7,
      "slot": "K",
      "player_id": "12711"
    },
    {
      "slot_index": 8,
      "slot": "DEF",
      "player_id": "PIT"
    }
  ],
  "lineup_id": "4c1128b33c82440e92d326a0d40855c8",
  "recorded_at": "2026-09-09T05:04:32.162335+00:00",
  "previous_lineup_id": "fa3437bf0aa84ae2a4bd79a42496b686"
}