{
  "schema_version": 2,
  "rationale": "This lineup fills the available legal starting slots and maximizes the supported weekly projected scoring components while preserving locked starters. Compared with the observed lineup, it changes Patrick Mahomes to Brock Purdy at QB. The modeled gain is 0.91 supported points. Availability still needs review for Zay Flowers, D'Andre Swift. These forecasts omit some league scoring categories; this proposal requires fresh validation and has not been applied.",
  "rationale_source": "deterministic_report_summary",
  "league_id": "1400628784381612032",
  "roster_id": 10,
  "season": 2026,
  "week": 1,
  "created_at": "2026-09-09T05:02:47.163779+00:00",
  "origin": {
    "kind": "optimizer",
    "input_hash": "5f9d177d3c7c0a6f903ca82fb53112f0e0be854ac2740d361d043d627de2dcee",
    "engine_version": 1
  },
  "assignments": [
    {
      "slot_index": 0,
      "slot": "QB",
      "player_id": "8183"
    },
    {
      "slot_index": 1,
      "slot": "RB",
      "player_id": "3198"
    },
    {
      "slot_index": 2,
      "slot": "RB",
      "player_id": "4866"
    },
    {
      "slot_index": 3,
      "slot": "WR",
      "player_id": "9997"
    },
    {
      "slot_index": 4,
      "slot": "WR",
      "player_id": "9487"
    },
    {
      "slot_index": 5,
      "slot": "TE",
      "player_id": "12506"
    },
    {
      "slot_index": 6,
      "slot": "FLEX",
      "player_id": "6790"
    },
    {
      "slot_index": 7,
      "slot": "K",
      "player_id": "12711"
    },
    {
      "slot_index": 8,
      "slot": "DEF",
      "player_id": "PIT"
    }
  ],
  "lineup_id": "fa3437bf0aa84ae2a4bd79a42496b686",
  "recorded_at": "2026-09-09T05:02:47.843594+00:00",
  "previous_lineup_id": "0e394b3747d441c4876bc8c956fe9a77"
}